What is the capital of France?,The capital of France is Paris.,It's Paris.
Explain the process of photosynthesis.,"Photosynthesis is a process that converts carbon dioxide and water into sugar (glucose) using sunlight as energy.The equation for photosynthesis is: 6CO2 + 6H2O + light energy → C6H12O6 + 6O2Photosynthesis occurs in plants and some bacteria and algae. It is the primary source of oxygen on Earth, making it essential for most life forms to survive.","Photosynthesis is a reaction that converts carbon dioxide and water into sugar with the help of light. A water molecule is split into a hydrogen ion and a hydroxyl radical. An electron is released from one water molecule, which gets oxidized to a hydrogen atom with one proton. At the same time, a hydroxyl radical will be reduced with a hydrogen atom from a different water molecule. Carbon dioxide will react with a hydrogen ion to form a carboxyl group (a carboxylic acid). Three water molecules will react with a carboxyl group to make one glucose molecule with three water molecules going to waste. Electrons will go back to where they started, making water again. All water will go back to where it started, making one water molecule. Ribulose bisphosphate will be broken down to make 3-PGA (three phosphoglycerate) with one water going to waste. Energy is needed in this step. Ribulose bisphosphate is made up of 2 ribuloses together. Both water molecules bind to separate ribuloses making one 2 water molecules together. Ribulose is a hexose sugar, meaning it has six carbons. Bisphosphate is added on to make ribulose bisphosphate. Bisphosphate is added on both ends, making one 2 water molecules together. Bisphosphate is added on both ends, making one 2 water molecules together. Bisphosphate is added on both ends, making one 2 water molecules together. Bisphosphate is added on both ends, making one 2 water molecules together. Bisphosphate is added on both ends, making one 2 water molecules together. Bisphosphate is added on both ends, making one 2 water molecules together. Bisphosphate is added on both ends, making one 2 water molecules together."
What are the basic rules of chess?,The basic rules of chess are:1. The game is played between two players on a checkerboard 2. Each player has 16 pieces and starts with them in back rank 3. White moves first and thereafter each player alternatively.,"A game played on a checkerboard with 8x8 squares. Rules can be found online on wikipedia, for example at this page: https://en.Professional-support.Blogspot.Mediterranean.Tours/page/Chess_rules.Blank"
Describe the water cycle.,"The water cycle is also called hydrologic cycle. It is the continuous movement of water between land, atmosphere, and ocean, driven by the sun's energy.","Water is a basic element on our planet earth, it surrounds all living organisms and it participate on many life processes. The water cycle is also called hydrologic cycle. Basically you can divide this cycle in three different parts: evaporation, precipitation and runoff. Evaporation is the process that water molecules go from liquid state to gas state. As water dissolves many chemicals it will change it composition during the process, it will be a new solution with different characteristics. As water dissolves many chemicals it will change it composition during the process, it will be a new solution with different characteristics. As water dissolves many chemicals it will change it composition during the process, it will be a new solution with different characteristics. As water dissolves many chemicals it will change it composition during the process, it will be a new solution with different characteristics. As water dissolves many chemicals it will change it composition during the process, it will be a new solution with different characteristics. As water dissolves many chemicals it will change it composition during the process, it will be a new solution with different characteristics. As water dissolves many chemicals it will change it composition during the process, it will be a new solution with different characteristics. As water dissolves many chemicals it will change it composition during the process, it will be a new solution with different characteristics. As water dissolves many chemicals it will change it composition during the process, it will be a new solution with different characteristics. As water dissolves many chemicals it will change it composition during the process, it will be a new solution with different characteristics. As water dissolves many chemicals it will change it composition during the process, it will be a new solution with different characteristics. As water dissolves many chemicals it will change it composition during the process, it will be a new solution with different characteristics. As water dissolves many chemicals it will change it composition during the process, it will be a new solution with different characteristics. As water dissolves many chemicals it will change it composition during the process, it will be a new solution with different characteristics. As water dissolves many chemicals it will change it composition during the process, it will be a new solution with different characteristics. As water dissolves many chemicals it will change it composition during the process, it will be a new solution with different characteristics."
Summarize the plot of 'Romeo and Juliet'.,"The play is set in Verona, where Romeo Montague falls in love with Juliet Capulet. However, the two are from rival families, and so their romance is not approved of. They marry secretly and conceive a child, but tragedy strikes when they both die.","A play by William Shakespeare, it is about a young girl named Juliet who falls in love with a boy her family hate and a boy name Romeo falls in love with her and they both fall madly in love with each other they married secretly but both families hate them and they will do anything to stop them from being together they fight a war with swords they both die they say goodbye in a church they both say they wish they could live again one day they say goodbye a soldier comes he shoots them they both fall on the ground they both say goodbye they both fall on the floor they both say goodbye they fall on the floor they both fall on the floor they both fall on the floor they both fall on the floor they both fall on the floor they both fall on the floor they both fall on the floor they both fall on the floor they both fall on the floor they both fall on the floor they both fall on the floor they both fall on the floor Chill you old woman chill you old woman chill you old woman chill you old woman chill you old woman chill you old woman chill you old woman chill you old woman chill you old woman chill you old woman chill you old woman chill you old woman chill you old woman chill you old woman chill you old woman chill you old woman chill you old woman chill you old woman chill you old woman chill you old woman chill you old woman chill you old woman chill you old woman chill you old woman chill you old woman chill you old woman chill you old woman chill you old woman chill you old woman chill you old woman chill you old woman chill you old woman chill you old woman chill you old woman chill you old woman chill you old woman chill you old woman chill you old woman chill you old woman chill you old woman chill you old woman chill you old woman chill you old woman chill you old woman chill you old woman chill you old woman chill you old woman chill you old woman chill you old woman chill yo Chill you old woman chill you old woman chill you old woman chill you old woman chill you old woman chill you old woman chill you old woman chill you old woman chill you old woman chill you old woman chill you old woman chill you old woman chill you old woman chill you old woman chill you old woman chill you old woman chill you old woman chill you old woman chill you old woman chill you old woman chill you old woman chill you old woman chill you old woman chill you old woman chill you old woman chill you old woman chill you old woman chill you old woman chill you old woman chill you old woman chill you old woman chill you old woman chill you old woman chill you old woman chill you old woman chill you old woman chill you old woman chill you old woman chill you old woman chill you old woman chill you old woman chill you old woman chill you old woman chill you old woman chill you old woman chill you old woman chill you old woman chill you old woman chill you old woman chill yo Chill you old woman chill you old woman chill you old woman chill you old woman chill you old woman chill you old woman chill you old woman chill you old woman chill you old woman chill you old woman chill you old woman chill you old woman chill you old woman chill you old woman chill you old woman chill you old woman chill you old woman chill you old woman chill you old woman chill you old woman chill you old woman chill you old woman chill you old woman chill you old woman chill you old woman chill you old woman chill you old woman chill you old woman chill you old woman chill you old woman chill you old woman chill you old woman chill you old woman chill you old woman chill you old woman chill you old woman chill you old woman chill you old woman chill you old woman chill you old woman chill you old woman chill you old woman chill you old woman chill you old woman chill you old woman chill you old woman chill you old woman chill you old woman chill you old woman chill yo Chill you old woman chill you old woman chill you old woman chill you old woman chill you old woman chill you old woman chill you old woman chill you old woman chill you old woman chill you old woman chill you old woman chill you old woman chill you old woman chill you old woman chill you old woman chill you old woman chill you old woman chill you old woman chill you old woman chill you old woman chill you old woman chill you old woman chill you old woman chill you old woman chill you old woman chill you old woman chill you old woman chill you old woman chill you old woman chill you old woman chill you old woman chill you old woman chill you old woman chill you old woman chill you old woman chill you old woman chill you old woman chill you old woman chill you old woman chill you old woman chill you old woman chill you old woman chill you old woman chill you old woman chill you old woman chill you old woman chill you old woman chill you old woman chill you old woman chill yo Chill you old woman chill you old woman chill you old woman chill you old woman chill you old woman chill you old woman chill you old woman chill you old woman chill you old woman chill you old woman chill you old woman chill you old woman chill you old woman chill you old woman chill you old woman chill you old woman chill you old woman chill you old woman chill you old woman chill you old woman chill you old woman chill you old woman chill you old woman chill you old woman chill you old woman chill you old woman chill you old woman chill you old woman chill you old woman chill you old woman chill you old woman chill you old woman chill you old woman chill you old woman chill you old woman chill you old woman chill you old woman chill you old woman chill you old woman chill you old woman chill you old woman chill you old woman chill you old woman chill you old woman chill you old woman chill you old woman chill you old woman chill you old woman chill you old woman chill yo Chill you old woman chill you old woman chill you old woman chill you old woman chill you old woman chill you old woman chill you old woman chill you old woman chill you old woman chill you old woman chill you old woman chill you old woman chill you old woman chill you old woman chill you old woman chill you old woman chill you old woman chill you old woman chill you old woman chill you old woman chill you old woman chill you old woman chill you old woman chill you old woman chill you old woman chill you old woman chill you old woman chill you old woman chill you old woman chill you old woman chill you old woman chill you old woman chill you old woman chill you old woman chill you old woman chill you old woman chill you old woman chill you old woman chill you old woman chill you old woman chill you old woman chill you old woman chill you old woman chill you old woman chill you old woman chill you old woman chill you old woman chill you old woman chill you old woman chill yo Chill you old woman chill you old woman chill you old woman chill you old woman chill you old woman chill you old woman chill you old woman chill you old woman chill you old woman chill you old woman chill you old woman chill you old woman chill you old woman chill you old woman chill you old woman chill you old woman chill you old woman chill you old woman chill you old woman chill you old woman chill you old woman chill you old woman chill you old woman chill you old woman chill you old woman chill you old woman chill you old woman chill you old woman chill you old woman chill you old woman chill you old woman chill you old woman chill you old woman chill you old woman chill you old woman chill you old woman chill you old woman chill you old woman chill you old woman chill you old woman chill you old woman chill you old woman chill you old woman chill you old woman chill you old woman chill you old woman chill you old woman chill you old woman chill you old woman chill yo Chill you old woman chill you old woman chill you old woman chill you old woman chill you old woman chill you old woman chill you old woman chill you old woman chill you old woman chill you old woman chill you old woman chill you old woman chill you old woman chill you old woman chill you old woman chill you old woman chill you old woman chill you old woman chill you old woman chill you old woman chill you old woman chill you old woman chill you old woman chill you old woman chill you old woman chill you old woman chill you old woman chill you old woman chill you old woman chill you old woman chill you old woman chill you old woman chill you old woman chill you old woman chill you old woman chill you old woman chill you old woman chill you old woman chill you old woman chill you old woman chill you old woman chill you old woman chill you old woman chill you old woman chill you old woman chill you old woman chill you old woman chill you old woman chill you old woman chill yo Chill you old woman chill you old woman chill you old woman chill you old woman chill you old woman chill you old woman chill you old woman chill you old woman chill you old woman chill you old woman chill you old woman chill you old woman chill you old woman chill you old woman chill you old woman chill you old woman chill you old woman chill you old woman chill you old woman chill you old woman chill you old woman chill you old woman chill you old woman chill you old woman chill you old woman chill you old woman chill you old woman chill you old woman chill you old woman chill you old woman chill you old woman chill you old woman chill you old woman chill you old woman chill you old woman chill you old woman chill you old woman chill you old woman chill you old woman chill you old woman chill you old woman chill you old woman chill you old woman chill you old woman chill you old woman chill you old woman chill you old woman chill you old woman chill you old woman chill yo Chill you old woman chill you old woman chill you old woman chill you old woman chill you old woman chill you old woman chill you old woman chill you old woman chill you old woman chill you old woman chill you old woman chill you old woman chill you old woman chill you old woman chill you old woman chill you old woman chill you old woman chill you old woman chill you old woman chill you old woman chill you old woman chill you old woman chill you old woman chill you old woman chill you old woman chill you old woman chill you old woman chill you old woman chill you old woman chill you old woman chill you old woman chill you old woman chill you old woman chill you old woman chill you old woman chill you old woman chill you old woman chill you old woman chill you old woman chill you old woman chill you old woman chill you old woman chill you old woman chill you old woman chill you old woman chill you old woman chill you old woman chill you old woman chill you old woman chill yo Chill you old woman chill you old woman chill you old woman chill you old woman chill you old woman chill you old woman chill you old woman chill you old woman chill you old woman chill you old woman chill you old woman chill you old woman chill you old woman chill you old woman chill you old woman chill you old woman chill you old woman chill you old woman chill you old woman chill you old woman chill you old woman chill you old woman chill you old woman chill you old woman chill you old woman chill you old woman chill you old woman chill you old woman chill you old woman chill you old woman chill you old woman chill you old woman chill you old woman chill you old woman chill you old woman chill you old woman chill you old woman chill you old woman chill you old woman chill you old woman chill you old woman chill you old woman chill you old woman chill you old woman chill you old woman chill you old woman chill you old woman chill you old woman chill you old woman chill yo Chill you old woman chill you old woman chill you old woman chill you old woman chill you old woman chill you old woman chill you old woman chill you old woman chill you old woman chill you old woman chill you old woman chill you old woman chill you old woman chill you old woman chill you old woman chill you old woman chill you old woman chill you old woman chill you old woman chill you old woman chill you old woman chill you old woman chill you old woman chill you old woman chill you old woman chill you old woman chill you old woman chill you old woman chill you old woman chill you old woman chill you old woman chill you old woman chill you old woman chill you old woman chill you old woman chill you old woman chill you old woman chill you old woman chill you old woman chill you old woman chill you old woman chill you old woman chill you old woman chill you old woman chill you old woman chill you old woman chill you old woman chill you old woman chill you old woman chill yo Chill you old woman chill you old woman chill you old woman chill you old woman chill you old woman chill you old woman chill you old woman chill you old woman chill you old woman chill you old woman chill you old woman chill you old woman chill you old woman chill you old woman chill you old woman chill you old woman chill you old woman chill you old woman chill you old woman chill you old woman chill you old woman chill you old woman chill you old woman chill you old woman chill you old woman chill you old woman chill you old woman chill you old woman chill you old woman chill you old woman chill you old woman chill you old woman chill you old woman chill you old woman chill you old woman chill you old woman chill you old woman chill you old woman chill you old woman chill you old woman chill you old woman chill you old woman chill you old woman chill you old woman chill you old woman chill you old woman chill you old woman chill you old woman chill you old woman chill yo Chill you old woman chill you old woman chill you old woman chill you old woman chill you old woman chill you old woman chill you old woman chill you old woman chill you old woman chill you old woman chill you old woman chill you old woman chill you old woman chill you old woman chill you old woman chill you old woman chill you old woman chill you old woman chill you old woman chill you old woman chill you old woman chill you old woman chill you old woman chill you old woman chill you old woman chill you old woman chill you old woman chill you old woman chill you old woman chill you old woman chill you old woman chill you old woman chill you old woman chill you old woman chill you old woman chill you old woman chill you old woman chill you old woman chill you old woman chill you old woman chill you old woman chill you old woman chill you old woman chill you old woman chill you old woman chill you old woman chill you old woman chill you old woman chill you old woman chill yo Chill you old woman chill you old woman chill you old woman chill you old woman chill you old woman chill you old woman chill you old woman chill you old woman chill you old woman chill you old woman chill you old woman chill you old woman chill you old woman chill you old woman chill you old woman chill you old woman chill you old woman chill you old woman chill you old woman chill you old woman chill you old woman chill you old woman chill you old woman chill you old woman chill you old woman chill you old woman chill you old woman chill you old woman chill you old woman chill you old woman chill you old woman chill you old woman chill you old woman chill you old woman chill you old woman chill you old woman chill you old woman chill you old woman chill you old woman chill you old woman chill you old woman chill you old woman chill you old woman chill you old woman chill you old woman chill you old woman chill you old woman chill you old woman chill you old woman chill yo Chill you old woman chill you old woman chill you old woman chill you old woman chill you old woman chill you old woman chill you old woman chill you old woman chill you old woman chill you old woman chill you old woman chill you old woman chill you old woman chill you old woman chill you old woman chill you old woman chill you old woman chill you old woman chill you old woman chill you old woman chill you old woman chill you old woman chill you old woman chill you old woman chill you old woman chill you old woman chill you old woman chill you old woman chill you old woman chill you old woman chill you old woman chill you old woman chill you old woman chill you old woman chill you old woman chill you old woman chill you old woman chill you old woman chill you old woman chill you old woman chill you old woman chill you old woman chill you old woman chill you old woman chill you old woman chill you old woman chill you old woman chill you old woman chill you old woman chill yo Chill you old woman chill you old woman chill you old woman chill you old woman chill you old woman chill you old woman chill you old woman chill you old woman chill you old woman chill you old woman chill you old woman chill you old woman chill you old woman chill you old woman chill you old woman chill you old woman chill you old woman chill you old woman chill you old woman chill you old woman chill you old woman chill you old woman chill you old woman chill you old woman chill you old woman chill you old woman chill you old woman chill you old woman chill you old woman chill you old woman chill you old woman chill you old woman chill you old woman chill you old woman chill you old woman chill you old woman chill you old woman chill you old woman chill you old woman chill you old woman chill you old woman chill you old woman chill you old woman chill you old woman chill you old woman chill you old woman chill you old woman chill you old woman chill you old woman chill yo Chill you old woman chill you old woman chill you old woman chill you old woman chill you old woman chill you old woman chill you old woman chill you old woman chill you old woman chill you old woman chill you old woman chill you old woman chill you old woman chill you old woman chill you old woman chill you old woman chill you old woman chill you old woman chill you old woman chill you old woman chill you old woman chill you old woman chill you old woman chill you old woman chill you old woman chill you old woman chill you old woman chill you old woman chill you old woman chill you old woman chill you old woman chill you old woman chill you old woman chill you old woman chill you old woman chill you old woman chill you old woman chill you old woman chill you old woman chill you old woman chill you old woman chill you old woman chill you old woman chill you old woman chill you old woman chill you old woman chill you old woman chill you old woman chill you old woman chill yo Chill you old woman chill you old woman chill you old woman chill you old woman chill you old woman chill you old woman chill you old woman chill you old woman chill you old woman chill you old woman chill you old woman chill you old woman chill you old woman chill you old woman chill you old woman chill you old woman chill you old woman chill you old woman chill you old woman chill you old woman chill you old woman chill you old woman chill you old woman chill you old woman chill you old woman chill you old woman chill you old woman chill you old woman chill you old woman chill you old woman chill you old woman chill you old woman chill you old woman chill you old woman chill you old woman chill you old woman chill you old woman chill you old woman chill you old woman chill you old woman chill you old woman chill you old woman chill you old woman chill you old woman chill you old woman chill you old woman chill you old woman chill you old woman chill you old woman chill yo"
