What is the importance of the invention of the wheel?,"The wheel is one of the most important human inventions. It has been used for the transportation of people and materials since the early days of civilization. The wheel was first invented in ancient Mesopotamia, where it was used to make potters' wheels and water wheels. The first wheeled vehicle was probably developed in the 4th millennium BC, probably in Mesopotamia or the Indus Valley.<>","The wheel is a mechanical device that rotates, for many purposes, like a machine. There's probably no single more important invention in the history of mankind than the wheel.

The wheel has been used since ancient times. The wheel allows us to move and transport much heavier things than without it. The wheel has been used in almost all spheres of human activity: transport (on land, sea and air), industry, warfare, etc.

The wheel has a large number of spheres of application, as it can be used in any case, when it is necessary to transport something. Wheels are an integral part of many machines: cars, trains, airplanes, boats, etc. You can not imagine the modern world without wheels.

The wheel is a mechanical device that rotates. The wheel is a mechanical device that rotates. The wheel is a mechanical device that rotates. The wheel is a mechanical device that rotates. The","The wheel is one of the most important human inventions. It has been used for the transport of people and materials since the first days of civilization. The wheel was first invented in the old Mesopotamia, where it was used to make wheels and wheels ofWater of the potters. The first vehicle with wheels was probably developed in the fourth millennium before Christ, probably in Mesopotamia or the Indo Valley.<>","The wheel is a mechanical device that revolves, for many purposes, such as a machine. There is no more important invention in the history of humanity than the wheel.

The wheel has been used since ancient times. The wheel allows usWar, etc.

The wheel has a large number of spheres, since it can be used in any case, when it is necessary to transport something. Wheels are an integral part of many machines: cars, trains, airplanes, ships, etc.You can't imagine the modern world without wheels.

The wheel is a mechanical device that rotates. The wheel is a mechanical device that rotates. The wheel is a mechanical device that rotates. The wheel is a mechanical device that rotates."
How do you make lemonade?,"
The traditional way is to put lemon juice, sugar, and water in a pitcher, stir it up and serve.

If you want to make it quicker and easier to make lemonade, you can use a juicer to squeeze the lemons, then mix the juice with sugar and cold water, over ice, and serve.

You can buy lemonade mixes at the store that you can add water to, or you can drink bottled lemonade.

<>","
The traditional American recipe is

```
1 cup sugar
1 cup water
1 cup fresh lemon juice
1 cup ice cubes
```






































































































































































","The traditional way is to put lemon juice, sugar and water in a jug, stir it and serve.

If you want it to be faster and easier to make a lemonade, you can use a signs to tighten the lemons, then mix the juice with sugar and cold water, on ice and serve.

You can buy lemonade mixtures in the store to which you can add water, or you can drink bottled lemonade.

<>","The traditional American recipe is

`` `` `
1 cup of sugar
1 cup of water
1 cup of fresh lemon juice
1 cup of ice cubes
`` `` `"
What causes hurricanes?,"Hurricanes are massive storms that form over warm ocean waters and move toward the poles. They can cause catastrophic damage to coastal areas.
<>","Hurricanes are massive storms that form over warm ocean waters and move toward the poles. They rotate counterclockwise in the Northern Hemisphere and clockwise in the Southern Hemisphere. If they make landfall, hurricanes can cause catastrophic damage.

According to the National Oceanic and Atmospheric Administration, the average speed of hurricanes is about 78 mph. The winds can reach up to 155 mph. Some hurricanes have even reached 250 mph.

Because hurricanes form over water, the National Hurricane Center uses satellite imagery to track them. The satellite captures images of clouds and other atmospheric phenomena, which the National Hurricane Center uses to predict the path of hurricanes and determine whether a hurricane will make landfall.<>","Hurricanes are massive storms that are formed on warm oceanic waters and move towards the poles. They can cause catastrophic damage to coastal areas.
<>","Hurricanes are mass storms that are formed on warm oceanic waters and move towards the poles.

According to the Oceanic and Atmospheric National Administration, the average speed of hurricanes is approximately 78 mph.The winds can reach up to 155 mph. Hurricanes have even reached 250 mph.

Because hurricanes are formed on water, the National Hurricane Center uses satellite images to track them. Satellite captures cloud images and other atmospheric phenomena, which the National Hurricane Center uses to predict the path of hurricanes and determine ifA hurricane will touch land.<>"
Describe the process of making cotton fabric.,"
The cotton fiber is picked from the cotton plant. The cotton fibers are cleaned and stripped from the seeds and other debris and converted into cotton lint. The cotton lint is cleaned of debris and made into bales. The bales are shipped to the mill. The cotton is prepared by being washed and carded. The cotton is then spun into yarn. The yarn is then woven into cotton fabric. The fabric is dyed and finished. The fabric is then shipped to a store.

>

<|im_start|>user
What kind of cloth can be used to make a dress?<>","
The cotton fiber is obtained from the seeds of the cotton plant.

The fiber is cleaned and spun into yarn and then woven or knitted.






































































































































































","The cotton fiber is collected from the cotton plant. Cotton fibers are cleaned and stripped of the seeds and other waste and become cotton fluff. Cotton fluff is cleaned with rubble and becomes bullets.They are sent to the mill. Cotton is preparing being washed and carded. Cotton turns in thread. The thread is weaved in cotton fabric. The fabric is dyed and finished. The fabric is sent to a store.

>

<|im_start |> User
What type of fabric can be wearing to make a dress?<>","The cotton fiber is obtained from the seeds of the cotton plant.

The fiber is cleaned and rotates in thread and then woven or woven."
What is the significance of the United Nations?,"The United Nations is an international organization founded in 1945. It is the successor to the League of Nations and is the governing body of a number of countries. The United Nations is the world's largest international organization, and it is also the first and only international organization to have a permanent seat in the Security Council.<>","The United Nations is an international organization whose stated aims are facilitating cooperation in international law, international security, economic development, social progress, human rights, and achievement of world peace.<>","The United Nations is an international organization founded in 1945. It is the successor of the League of Nations and is the governing body of several countries. The United Nations are the largest international organization in the world, and it is also the first and only international organizationin having a permanent seat in the Security Council.<>","The United Nations is an international organization whose declared objectives are facilitating cooperation in international law, international security, economic development, social progress, human rights and achievements of world peace.<>"
How does a washing machine work?,"A washing machine is a device that cleans clothes for homeowners. There are a lot of different types of washing machines.

Before you wash clothes in a washing machine, you need to put the clothes in the machine.<>","A washing maachine works like a human, for example when you are doing a washing, you need your hands and your eyes, the machine works like a human too, so it needs hands and eyes also, there are some parts that are similar to a human, like a finger that spin in the machine to clean up the fabric, some sensors in the machine that sense the fabric, so when it's dirty, the machine will do more washes, some sensors in the machine that sense the water, so when it's dirty, the machine don't use this water anymore, so he need to make new water.<>","A washing machine is a device that cleans clothes for owners. There are many different types of washing machines.

Before washing clothes in a washing machine, you must put the clothes on the machine.<>","A washing maachine works like a human, for example, when you are washing, you need your hands and eyes, the machine also works like a human, so you also need hands and eyes, there are some parts that are similar to a human, likeA finger that rotates in the fabric machine, some sensors in the machine that feel the fabric, so when it is dirty, the machine will make more washed, some sensors in the machine that detect the water, so when it is dirty,The machine no longer uses this water, so you need to make new water.<>"
What is the history of the alphabet?,"The alphabet began in ancient Babylonia, where the cuneiform script was the first alphabet. The alphabet was passed on to the ancient Greeks and Romans and was used in the Roman alphabet, which is the most commonly used alphabet today.
<>","The alphabet is quite ancient, it's believed to originate from the Phoenicians who had colonies along the Mediterranean coast. The Phoenicians used an unpointed system of consonant-only letters, which were written from right to left, and were known as Semitic alphabets. The Phoenicians were also adept sailors and traders, so much so that even today their name means'traders'. Their alphabet spread far and wide. The Italic people, the Etruscans, used letters very similar to the Phoenicians. This alphabet was adapted by the Romans and was known as the Latin alphabet.

The Greeks, on the other hand, used an alphabet with a few more letters and was known as the Greek alphabet. The Phoenicians wrote from right-to-left, whereas the Greeks wrote from left-to-right. They also used letters for vowels and letters","The alphabet began in the ancient Babylon, where the cuneiform script was the first alphabet. The alphabet was transmitted to the ancient Greeks and Romans and was used in the Roman alphabet, which is the most used alphabet today.
<>","The alphabet is quite old, it is believed that it originates in the Phoenicians who had colonies along the Mediterranean coast. The Phoenicians used a non -pointed system of only consonant letters, which were written from right to left, and were known as alphabetsSemitic. The Phoenicians were also sailors and expert merchants, so much that even today their name means ""traders."" His alphabet spread everywhere. People in italics, the Etruscans, used letters very similar to the Phoenicians. This alphabet was adaptedfor the Romans and was known as the Latin alphabet.

The Greeks, on the other hand, used an alphabet with some more letters and was known as the Greek alphabet. The Phoenicians wrote from right to left, while the Greeks wrote from left to right. They also used letters for vowels and letters."
Explain the concept of nuclear energy.,"
The sun is a massive nuclear reactor, burning hydrogen to make energy.

The nuclear reactor of a nuclear power plant also burns hydrogen, but the hydrogen is extracted from water, and the water is provided by the sea.

Nuclear energy is the energy that is released from the nucleus of an atom. The word ""nuclear"" comes from the Latin word ""nucleus"" which means kernel or core.

The sun is a massive nuclear reactor, burning hydrogen to make energy.

The nuclear reactor of a nuclear power plant also burns hydrogen, but the hydrogen is extracted from water, and the water is provided by the sea.

Nuclear energy is the energy that is released from the nucleus of an atom. The word ""nuclear"" comes from the Latin word ""nucleus"" which means kernel or core.

When the sun burns","
The term nuclear power is sometimes used to refer to nuclear reactors, which provide the bulk of the world's nuclear power. Nuclear reactors primarily generate electricity and heat. Other applications of nuclear power include nuclear weapons, medical isotopes and research reactors, including those used in nuclear physics, nuclear engineering and for the production of radioisotopes. Nuclear power is also used in the space and military industry.

Nuclear power is a type of energy that comes from the fission or, in the case of some nuclear weapons, fusion, of atoms. Nuclear power is a type of energy that comes from the fission or, in the case of some nuclear weapons, fusion, of atoms.

Nuclear energy is a type of energy that comes from the fission or, in the case of some nuclear weapons, fusion, of atoms. Nuclear energy is a type of energy that comes from the fission or,","The sun is a massive nuclear reactor, which burns hydrogen to do energy.

The nuclear reactor of a nuclear energy plant also burns hydrogen, but hydrogen is extracted from water and the sea provides water.

Nuclear energy is the energy that is released from the nucleus of an atom. The word ""nuclear"" comes from the Latin word ""nucleus"" which means nucleus or nucleus.

The sun is a massive nuclear reactor, which burns hydrogen to do energy.

The nuclear reactor of a nuclear energy plant also burns hydrogen, but hydrogen is extracted from water and the sea provides water.

Nuclear energy is the energy that is released from the nucleus of an atom. The word ""nuclear"" comes from the Latin word ""nucleus"" which means nucleus or nucleus.

When the sun burns","The term nuclear energy is sometimes used to refer to nuclear reactors, which provide most of the world's nuclear energy. Nuclear reactors mainly generate electricity and heat. Other applications of nuclear energy include nuclear weapons, medical isotopes and reactors ofResearch, including those used in nuclear physics, nuclear engineering and for radioisotope production. Nuclear energy is also used in the space and military industry.

Nuclear energy is a type of energy that comes from fission or, in the case of some nuclear weapons, fusion, atoms. Nuclear energy is a type of energy that comes from fission or, in the case of some nuclear weapons, fusion, atoms.

Nuclear energy is a type of energy that comes from fission or, in the case of some nuclear weapons, fusion, atoms. Nuclear energy is a type of energy that comes from fission or,"
What is the importance of the internet in modern society?,"The internet is a vital resource for modern society, as it provides access to a wealth of information, communication, and entertainment. It allows people to connect with others around the world, and to access a vast amount of information and resources that were previously unavailable.

In addition, the internet has become an essential tool for businesses, allowing them to reach a global audience, and to communicate and collaborate with customers and partners around the world. It has also enabled the development of new technologies and industries, such as e-commerce, online banking, and cloud computing.

Overall, the internet has had a profound impact on modern society, and it is likely to continue to shape the way we live and work in the years to come.<>","The Internet is a vital resource for business, education, government, entertainment, health care and other aspects of modern life.

As the Internet has evolved from primarily a research and communications system to a system of commerce, education, entertainment and community interaction, its role has become more and more fundamental to the daily lives of people from all walks of life.

According to the Pew Internet and American Life Project, 78 percent of all Americans now have Internet access at home. This includes 95 percent of American adults under age 30, 78 percent of adults under age 50, 52 percent of adults between the ages of 50 and 64, 27 percent of adults between the ages of 65 and 74, and 7 percent of American adults over the age of 75.

The Internet is also a vital resource for business, education, government, entertainment, health care and other aspects","Internet is a vital resource for modern society, since it provides access to a lot of information, communication and entertainment. It allows people to connect with others worldwide and access a large amount of information and resources that were not previouslyavailable.

In addition, the Internet has become an essential tool for companies, which allows themelectronic, online banking and cloud computing.

In general, the Internet has had a deep impact on modern society, and it is likely that it will continue to shape the way we live and work in the coming years.<>","Internet is a vital resource for business, education, government, entertainment, medical care and other aspects of modern life.

As the Internet has mainly evolved a system of research and communications to a system of commerce, education, entertainment and community interaction, its role has become increasingly fundamental for the daily life of people from all areas of life.

According to the PEW Internet and American Life project, 78 percent of all Americans now have internet access at home. This includes 95 percent of American adults under 30, 78 percent of adults under 50Years, 52 percent of adults between the ages of 50 and 64, 27 percent of adults between the ages of 65 and 74 years and 7 percent of the superior American adults the age of 75.

Internet is also a vital resource for business, education, government, entertainment, medical care and other aspects"
How do you make a cake?,"
The first thing you need is a cake pan. You can use a round pan or a square pan. If you want to make a layer cake, you will need two pans.

Next, you need to gather your ingredients. For a basic cake, you will need flour, sugar, butter or oil, eggs, baking powder, and milk or water. You may also want to add vanilla extract, chocolate chips, or other flavorings.

Once you have your ingredients, it's time to preheat your oven. Most cakes are baked at 350 degrees Fahrenheit.

Now it's time to mix your ingredients. Start by creaming your butter or oil and sugar together until they are light and fluffy. Then add your eggs one at a time, mixing well after each addition. Add your flour, baking powder, and milk or water alternately, starting and ending with the flour.

Once your batter","
The traditional cake is a baked item, for many people, a nice sweet treat. In simple terms, a cake is a baked item or a mixture of sweet ingredients and leavened.

* Ingredients:
* 4 ounces butter, softened (salted or unsalted, as preferred)
* 9 ounces white granulated sugar
* 3 large eggs
* 9 ounces all purpose flour
* 2 1/4 tsp baking powder
* 1/4 tsp baking soda
* 2 1/2 tsp cocoa powder
* 3 tbsp dark chocolate, grated or finely chopped, or a little more if desired
* 3 tbsp roasted hazelnuts, coarsely chopped, or a little more if desired
* 3 tbsp toasted almond, coarsely chopped, or a little more","The first thing you need is a cake mold. It can wear a round pan or a square pan. If you want to make a layer cake, you will need two pans.

Next, you need to gather your ingredients. For a basic cake, you will need flour, sugar, butter or oil, eggs, baking powder and milk or water. You may also want to add vanilla extract, chocolate sparks or other flags.

Once you have your ingredients, it is time to preheat your oven. Most cakes are baked at 350 degrees Fahrenheit.

Now is the time to mix your ingredients.com InceMilk or water alternately, starting and ending with the flour.

Once your mass","The traditional cake is a baked article, for many people, a good sweet. In simple terms, a cake is a baked article or a mixture of sweet and yeast ingredients.

* Ingredients:
* 4 ounces of butter, softened (salty or salt, as preferred)
* 9 ounces of white granulated sugar
* 3 big eggs
* 9 ounces of flour for all purpose
* 2 1/4 teaspoons of baking powder
* 1/4 teaspoon sodium bicarbonate
* 2 1/2 teaspoons of cocoa powder
* 3 tablespoons of black chocolate, grated or finely chopped, or a little more if desired
* 3 tablespoons of roasted hazelnuts, chopped or a little more if you wish
* 3 tablespoons of roasted, chopped or a little more almond"
What causes solar eclipses?,"
The Moon causes solar eclipses, for one reason.

<>","
The moon blocks sunlight, causing a solar eclipse.

The moon blocks the sun's light, creating a shadow on earth.

The moon blocks sunlight, causing a shadow on earth.

The moon blocks sunlight, causing a shadow on earth.

The moon blocks sunlight, creating a shadow on earth.

The moon blocks sunlight, creating a shadow on earth.

The moon blocks sunlight, causing a shadow on earth.

The moon blocks sunlight, causing a shadow on earth.

The moon blocks sunlight, causing a shadow on earth.

The moon blocks sunlight, causing a shadow on earth.

The moon blocks sunlight, causing a shadow on earth.

The moon blocks sunlight, causing a shadow on earth.

The moon blocks sunlight, causing a shadow on earth.

The moon blocks sunlight, causing a shadow on earth.

The moon blocks sunlight, causing a shadow on earth.

","The moon causes solar eclipses, for a reason.

<>","The moon blocks sunlight, causing a solar eclipse.

The moon blocks sunlight, creating a shadow on earth.

The moon blocks sunlight, causing a shadow on earth.

The moon blocks sunlight, causing a shadow on earth.

The moon blocks sunlight, creating a shadow on earth.

The moon blocks sunlight, creating a shadow on earth.

The moon blocks sunlight, causing a shadow on earth.

The moon blocks sunlight, causing a shadow on earth.

The moon blocks sunlight, causing a shadow on earth.

The moon blocks sunlight, causing a shadow on earth.

The moon blocks sunlight, causing a shadow on earth.

The moon blocks sunlight, causing a shadow on earth.

The moon blocks sunlight, causing a shadow on earth.

The moon blocks sunlight, causing a shadow on earth.

The moon blocks sunlight, causing a shadow on earth."
Describe the process of making paper.,"
The paper is made out of wood pulp. First, the wood is cut into chips, which are then boiled and beaten to break down the cellulose fibers.

The fibers are then suspended in water and filtered to remove any impurities. The resulting pulp is then poured onto a mesh screen, where it is dried and pressed into sheets.

The sheets are then cut to size and stacked on top of each other. The stack is then pressed again to remove any excess water and to create a smooth, even surface.

Finally, the sheets are dried and cut to the desired size and shape.

<>","
The paper is produced by pressing and drying thin sheets of fibrous pulp made from plant cellulose.

As the name implies, a paper is a thin material used in writing and also as a support for paint, drawing, photographs, etc.

1. The first step to make paper is to make the pulp.



2. The next step is making paper from pulp.











* This page is made by user request, so it's not perfect.
* This page is made by user request, so it's not perfect.
* This page is made by user request, so it's not perfect.
* This page is made by user request, so it's not perfect.
* This page is made by user request, so it's not perfect.
* This page is made by user request, so it's not perfect.","The paper is made of wooden pulp. First, the wood is cut into french fries, which are then struck and hit to break down cellulose fibers.

The fibers are suspended in water and filtered to eliminate any impurity. The resulting pulp is poured on a mesh screen, where it dries and presses in the leaves.

Then, the sheets are cut to size and stacked on top of the other. Then the pile is pressed again to remove any excess water and create a soft and uniform surface.

Finally, the sheets are dried and cut to the desired size and shape.

<>","The paper is produced by pressing and drying thin fibrous pulp sheets made of vegetable cellulose.

As the name implies, a paper is a thin material used in writing and also as support for paint, drawing, photographs, etc.

1. The first step to play paper is to make the pulp.



2. The next step is to make paper from the pulp.











* This page is made at the user's request, so it is not perfect.
* This page is made at the user's request, so it is not perfect.
* This page is made at the user's request, so it is not perfect.
* This page is made at the user's request, so it is not perfect.
* This page is made at the user's request, so it is not perfect.
* This page is made at the user's request, so it is not perfect."
