What is the capital of France?,The capital of France is Paris.,It is Paris.
Explain the process of photosynthesis.,"Photosynthesis is a process that converts carbon dioxide and sugar water (glucose) using sunlight as energy.The equation for photosynthesis is: 6Co2 + 6H2O + Light energy → C6H12O6 + 6O2photosythesis occurs in plants and some bacteria and algae. It is the main source of oxygen on Earth, which makes it essential for most formsof life survive.","Photosynthesis is a reaction that converts carbon dioxide and water into sugar with the help of light. A water molecule is divided into a hydrogen ion and a hydroxyl radical. An electron is released from a water molecule, whichIt oxidizes a hydrogen atom with a proton. At the same time, a hydroxyl radical will be reduced with a hydrogen atom of a different water molecule. Carbon dioxide will react with a hydrogen ion to form a carboxyl group (an acidcarboxylic) .Trewater molecules will react with a carboxyl group to make a glucose molecule with three water molecules that are wasted. The electrons will return to where they began, making water again. All the water will return to where it began, making a molecule ofwater.The ribulous bisphosphate will decompose to make 3-PGA (three phosphoglyceracy) with a water that is wasted. Energy is needed in this step. The ribulous bisphosphate is composed of 2 ribulosis joints.They make a 2 water molecules together. Ribulous is a hexose sugar, which means that it has six carbons. Bisphosphate is added to make ribulous bisphosphate. The bisphosphate is added at both ends, making a 2 water molecules together. Bisphosphate isAdd at both ends, making a 2 water molecules together. Bisphosphate is added at both ends, making a 2 water molecules together. Bisphosphate is added at both ends, making a 2 molecules of water together. The bisphosphate is added inboth ends, making a 2 water molecules together. Bisphosphate is added at both ends, making a 2 water molecules together. Bisphosphate is added at both ends, making a 2 water molecules together."
What are the basic rules of chess?,The basic chess rules are: 1. The game is played between two players on a chess board 2. Each player has 16 pieces and begins with them in the back range 3. White moves first and then each player alternately.,"A game played on a chess board with 8x8 squares. The rules can be found online on Wikipedia, for example, on this page: https://en.professional-support.blogspot.Mediterranean.tours/page/ches_rules.blank"
Describe the water cycle.,"The water cycle is also called the hydrological cycle. It is the continuous movement of water between the earth, the atmosphere and the ocean, driven by the energy of the sun.","Water is a basic element on our planet Earth, it surrounds all living organisms and participates in many life processes. The water cycle is also called the hydrological cycle. Basically, this cycle can divide into three different parts: evaporation, precipitation andrunrentia. Evaporation is the process that water molecules pass from a liquid state to the gas status. As the water dissolves many chemicals, it will change its composition during the process, it will be a new solution with different characteristics.That water dissolves many chemicals, will change its composition during the process, will be a new solution with different characteristics. As the water dissolves many chemicals, it will change its composition during the process, it will be a new solution with different characteristics. The measurementThat water dissolves many chemicals, will change its composition during the process, will be a new solution with different characteristics. As the water dissolves many chemicals, it will change its composition during the process, it will be a new solution with different characteristics. The measurementThat water dissolves many chemicals, will change its composition during the process, will be a new solution with different characteristics. As the water dissolves many chemicals, it will change its composition during the process, it will be a new solution with different characteristics. The measurementThat water dissolves many chemicals, will change its composition during the process, will be a new solution with different characteristics. As the water dissolves many chemicals, it will change its composition during the process, it will be a new solution with different characteristics. The measurementThat water dissolves many chemicals, will change its composition during the process, will be a new solution with different characteristics. As the water dissolves many chemicals, it will change its composition during the process, it will be a new solution with different characteristics. The measurementThat water dissolves many chemicals, will change its composition during the process, will be a new solution with different characteristics. As the water dissolves many chemicals, it will change its composition during the process, it will be a new solution with different characteristics. The measurementThat water dissolves many chemicals, will change its composition during the process, will be a new solution with different characteristics. As the water dissolves many chemicals, it will change its composition during the process, it will be a new solution with different characteristics. The measurementThat water dissolves many chemicals, will change its composition during the process, will be a new solution with different characteristics."
Summarize the plot of 'Romeo and Juliet'.,"The work is set in Verona, where Romeo Montague falls in love with Juliet Capulet. However, the two are from rival families, so their romance is not approved. They marry in secret and conceive a child, but the tragedy attacks when both bothThey die.","A play by William Shakespeare, it is about a young girl named Juliet who falls in love with a boy her family hate and a boy name Romeo falls in love with her and they both fall madly in love with each other they married secretly but both families hate them and they will do anything to stop them from being together they fight a war with swords they both die they say goodbye in a church they both say they wish they could live again one day they say goodbye a soldier comes he shoots them they both fall on the ground they both say goodbye they both fall on the floor they both say goodbye they fall on the floor they both fall on the floor they both fall on the floor they both fall on the floor they both fall on the floor they both fall on the floor they both fall on the floor they both fall on the floor they both fall on the floor they both fall on the floor they both fall on the floor they both fall on the floor Chill you old woman chill you old woman chill you old woman chill you old woman chill you old woman chill you old woman chill you old woman chill you old woman chill you old woman chill you old woman chill you old woman chill you old woman chill you old woman chill you old woman chill you old woman chill you old woman chill you old woman chill you old woman chill you old woman chill you old woman chill you old woman chill you old woman chill you old woman chill you old woman chill you old woman chill you old woman chill you old woman chill you old woman chill you old woman chill you old woman chill you old woman chill you old woman chill you old woman chill you old woman chill you old woman chill you old woman chill you old woman chill you old woman chill you old woman chill you old woman chill you old woman chill you old woman chill you old woman chill you old woman chill you old woman chill you old woman chill you old woman chill you old woman chill you old woman chill yo Chill you old woman chill you old woman chill you old woman chill you old woman chill you old woman chill you old woman chill you old woman chill you old woman chill you old woman chill you old woman chill you old woman chill you old woman chill you old woman chill you old woman chill you old woman chill you old woman chill you old woman chill you old woman chill you old woman chill you old woman chill you old woman chill you old woman chill you old woman chill you old woman chill you old woman chill you old woman chill you old woman chill you old woman chill you old woman chill you old woman chill you old woman chill you old woman chill you old woman chill you old woman chill you old woman chill you old woman chill you old woman chill you old woman chill you old woman chill you old woman chill you old woman chill you old woman chill you old woman chill you old woman chill you old woman chill you old woman chill you old woman chill you old woman chill you old woman chill yo Chill you old woman chill you old woman chill you old woman chill you old woman chill you old woman chill you old woman chill you old woman chill you old woman chill you old woman chill you old woman chill you old woman chill you old woman chill you old woman chill you old woman chill you old woman chill you old woman chill you old woman chill you old woman chill you old woman chill you old woman chill you old woman chill you old woman chill you old woman chill you old woman chill you old woman chill you old woman chill you old woman chill you old woman chill you old woman chill you old woman chill you old woman chill you old woman chill you old woman chill you old woman chill you old woman chill you old woman chill you old woman chill you old woman chill you old woman chill you old woman chill you old woman chill you old woman chill you old woman chill you old woman chill you old woman chill you old woman chill you old woman chill you old woman chill you old woman chill yo Chill you old woman chill you old woman chill you old woman chill you old woman chill you old woman chill you old woman chill you old woman chill you old woman chill you old woman chill you old woman chill you old woman chill you old woman chill you old woman chill you old woman chill you old woman chill you old woman chill you old woman chill you old woman chill you old woman chill you old woman chill you old woman chill you old woman chill you old woman chill you old woman chill you old woman chill you old woman chill you old woman chill you old woman chill you old woman chill you old woman chill you old woman chill you old woman chill you old woman chill you old woman chill you old woman chill you old woman chill you old woman chill you old woman chill you old woman chill you old woman chill you old woman chill you old woman chill you old woman chill you old woman chill you old woman chill you old woman chill you old woman chill you old woman chill you old woman chill yo Chill you old woman chill you old woman chill you old woman chill you old woman chill you old woman chill you old woman chill you old woman chill you old woman chill you old woman chill you old woman chill you old woman chill you old woman chill you old woman chill you old woman chill you old woman chill you old woman chill you old woman chill you old woman chill you old woman chill you old woman chill you old woman chill you old woman chill you old woman chill you old woman chill you old woman chill you old woman chill you old woman chill you old woman chill you old woman chill you old woman chill you old woman chill you old woman chill you old woman chill you old woman chill you old woman chill you old woman chill you old woman chill you old woman chill you old woman chill you old woman chill you old woman chill you old woman chill you old woman chill you old woman chill you old woman chill you old woman chill you old woman chill you old woman chill you old woman chill yo Chill you old woman chill you old woman chill you old woman chill you old woman chill you old woman chill you old woman chill you old woman chill you old woman chill you old woman chill you old woman chill you old woman chill you old woman chill you old woman chill you old woman chill you old woman chill you old woman chill you old woman chill you old woman chill you old woman chill you old woman chill you old woman chill you old woman chill you old woman chill you old woman chill you old woman chill you old woman chill you old woman chill you old woman chill you old woman chill you old woman chill you old woman chill you old woman chill you old woman chill you old woman chill you old woman chill you old woman chill you old woman chill you old woman chill you old woman chill you old woman chill you old woman chill you old woman chill you old woman chill you old woman chill you old woman chill you old woman chill you old woman chill you old woman chill you old woman chill yo Chill you old woman chill you old woman chill you old woman chill you old woman chill you old woman chill you old woman chill you old woman chill you old woman chill you old woman chill you old woman chill you old woman chill you old woman chill you old woman chill you old woman chill you old woman chill you old woman chill you old woman chill you old woman chill you old woman chill you old woman chill you old woman chill you old woman chill you old woman chill you old woman chill you old woman chill you old woman chill you old woman chill you old woman chill you old woman chill you old woman chill you old woman chill you old woman chill you old woman chill you old woman chill you old woman chill you old woman chill you old woman chill you old woman chill you old woman chill you old woman chill you old woman chill you old woman chill you old woman chill you old woman chill you old woman chill you old woman chill you old woman chill you old woman chill you old woman chill yo Chill you old woman chill you old woman chill you old woman chill you old woman chill you old woman chill you old woman chill you old woman chill you old woman chill you old woman chill you old woman chill you old woman chill you old woman chill you old woman chill you old woman chill you old woman chill you old woman chill you old woman chill you old woman chill you old woman chill you old woman chill you old woman chill you old woman chill you old woman chill you old woman chill you old woman chill you old woman chill you old woman chill you old woman chill you old woman chill you old woman chill you old woman chill you old woman chill you old woman chill you old woman chill you old woman chill you old woman chill you old woman chill you old woman chill you old woman chill you old woman chill you old woman chill you old woman chill you old woman chill you old woman chill you old woman chill you old woman chill you old woman chill you old woman chill you old woman chill yo Chill you old woman chill you old woman chill you old woman chill you old woman chill you old woman chill you old woman chill you old woman chill you old woman chill you old woman chill you old woman chill you old woman chill you old woman chill you old woman chill you old woman chill you old woman chill you old woman chill you old woman chill you old woman chill you old woman chill you old woman chill you old woman chill you old woman chill you old woman chill you old woman chill you old woman chill you old woman chill you old woman chill you old woman chill you old woman chill you old woman chill you old woman chill you old woman chill you old woman chill you old woman chill you old woman chill you old woman chill you old woman chill you old woman chill you old woman chill you old woman chill you old woman chill you old woman chill you old woman chill you old woman chill you old woman chill you old woman chill you old woman chill you old woman chill you old woman chill yo Chill you old woman chill you old woman chill you old woman chill you old woman chill you old woman chill you old woman chill you old woman chill you old woman chill you old woman chill you old woman chill you old woman chill you old woman chill you old woman chill you old woman chill you old woman chill you old woman chill you old woman chill you old woman chill you old woman chill you old woman chill you old woman chill you old woman chill you old woman chill you old woman chill you old woman chill you old woman chill you old woman chill you old woman chill you old woman chill you old woman chill you old woman chill you old woman chill you old woman chill you old woman chill you old woman chill you old woman chill you old woman chill you old woman chill you old woman chill you old woman chill you old woman chill you old woman chill you old woman chill you old woman chill you old woman chill you old woman chill you old woman chill you old woman chill you old woman chill yo Chill you old woman chill you old woman chill you old woman chill you old woman chill you old woman chill you old woman chill you old woman chill you old woman chill you old woman chill you old woman chill you old woman chill you old woman chill you old woman chill you old woman chill you old woman chill you old woman chill you old woman chill you old woman chill you old woman chill you old woman chill you old woman chill you old woman chill you old woman chill you old woman chill you old woman chill you old woman chill you old woman chill you old woman chill you old woman chill you old woman chill you old woman chill you old woman chill you old woman chill you old woman chill you old woman chill you old woman chill you old woman chill you old woman chill you old woman chill you old woman chill you old woman chill you old woman chill you old woman chill you old woman chill you old woman chill you old woman chill you old woman chill you old woman chill you old woman chill yo Chill you old woman chill you old woman chill you old woman chill you old woman chill you old woman chill you old woman chill you old woman chill you old woman chill you old woman chill you old woman chill you old woman chill you old woman chill you old woman chill you old woman chill you old woman chill you old woman chill you old woman chill you old woman chill you old woman chill you old woman chill you old woman chill you old woman chill you old woman chill you old woman chill you old woman chill you old woman chill you old woman chill you old woman chill you old woman chill you old woman chill you old woman chill you old woman chill you old woman chill you old woman chill you old woman chill you old woman chill you old woman chill you old woman chill you old woman chill you old woman chill you old woman chill you old woman chill you old woman chill you old woman chill you old woman chill you old woman chill you old woman chill you old woman chill you old woman chill yo Chill you old woman chill you old woman chill you old woman chill you old woman chill you old woman chill you old woman chill you old woman chill you old woman chill you old woman chill you old woman chill you old woman chill you old woman chill you old woman chill you old woman chill you old woman chill you old woman chill you old woman chill you old woman chill you old woman chill you old woman chill you old woman chill you old woman chill you old woman chill you old woman chill you old woman chill you old woman chill you old woman chill you old woman chill you old woman chill you old woman chill you old woman chill you old woman chill you old woman chill you old woman chill you old woman chill you old woman chill you old woman chill you old woman chill you old woman chill you old woman chill you old woman chill you old woman chill you old woman chill you old woman chill you old woman chill you old woman chill you old woman chill you old woman chill you old woman chill yo Chill you old woman chill you old woman chill you old woman chill you old woman chill you old woman chill you old woman chill you old woman chill you old woman chill you old woman chill you old woman chill you old woman chill you old woman chill you old woman chill you old woman chill you old woman chill you old woman chill you old woman chill you old woman chill you old woman chill you old woman chill you old woman chill you old woman chill you old woman chill you old woman chill you old woman chill you old woman chill you old woman chill you old woman chill you old woman chill you old woman chill you old woman chill you old woman chill you old woman chill you old woman chill you old woman chill you old woman chill you old woman chill you old woman chill you old woman chill you old woman chill you old woman chill you old woman chill you old woman chill you old woman chill you old woman chill you old woman chill you old woman chill you old woman chill you old woman chill yo Chill you old woman chill you old woman chill you old woman chill you old woman chill you old woman chill you old woman chill you old woman chill you old woman chill you old woman chill you old woman chill you old woman chill you old woman chill you old woman chill you old woman chill you old woman chill you old woman chill you old woman chill you old woman chill you old woman chill you old woman chill you old woman chill you old woman chill you old woman chill you old woman chill you old woman chill you old woman chill you old woman chill you old woman chill you old woman chill you old woman chill you old woman chill you old woman chill you old woman chill you old woman chill you old woman chill you old woman chill you old woman chill you old woman chill you old woman chill you old woman chill you old woman chill you old woman chill you old woman chill you old woman chill you old woman chill you old woman chill you old woman chill you old woman chill you old woman chill yo Chill you old woman chill you old woman chill you old woman chill you old woman chill you old woman chill you old woman chill you old woman chill you old woman chill you old woman chill you old woman chill you old woman chill you old woman chill you old woman chill you old woman chill you old woman chill you old woman chill you old woman chill you old woman chill you old woman chill you old woman chill you old woman chill you old woman chill you old woman chill you old woman chill you old woman chill you old woman chill you old woman chill you old woman chill you old woman chill you old woman chill you old woman chill you old woman chill you old woman chill you old woman chill you old woman chill you old woman chill you old woman chill you old woman chill you old woman chill you old woman chill you old woman chill you old woman chill you old woman chill you old woman chill you old woman chill you old woman chill you old woman chill you old woman chill you old woman chill yo Chill you old woman chill you old woman chill you old woman chill you old woman chill you old woman chill you old woman chill you old woman chill you old woman chill you old woman chill you old woman chill you old woman chill you old woman chill you old woman chill you old woman chill you old woman chill you old woman chill you old woman chill you old woman chill you old woman chill you old woman chill you old woman chill you old woman chill you old woman chill you old woman chill you old woman chill you old woman chill you old woman chill you old woman chill you old woman chill you old woman chill you old woman chill you old woman chill you old woman chill you old woman chill you old woman chill you old woman chill you old woman chill you old woman chill you old woman chill you old woman chill you old woman chill you old woman chill you old woman chill you old woman chill you old woman chill you old woman chill you old woman chill you old woman chill you old woman chill yo Chill you old woman chill you old woman chill you old woman chill you old woman chill you old woman chill you old woman chill you old woman chill you old woman chill you old woman chill you old woman chill you old woman chill you old woman chill you old woman chill you old woman chill you old woman chill you old woman chill you old woman chill you old woman chill you old woman chill you old woman chill you old woman chill you old woman chill you old woman chill you old woman chill you old woman chill you old woman chill you old woman chill you old woman chill you old woman chill you old woman chill you old woman chill you old woman chill you old woman chill you old woman chill you old woman chill you old woman chill you old woman chill you old woman chill you old woman chill you old woman chill you old woman chill you old woman chill you old woman chill you old woman chill you old woman chill you old woman chill you old woman chill you old woman chill you old woman chill yo Chill you old woman chill you old woman chill you old woman chill you old woman chill you old woman chill you old woman chill you old woman chill you old woman chill you old woman chill you old woman chill you old woman chill you old woman chill you old woman chill you old woman chill you old woman chill you old woman chill you old woman chill you old woman chill you old woman chill you old woman chill you old woman chill you old woman chill you old woman chill you old woman chill you old woman chill you old woman chill you old woman chill you old woman chill you old woman chill you old woman chill you old woman chill you old woman chill you old woman chill you old woman chill you old woman chill you old woman chill you old woman chill you old woman chill you old woman chill you old woman chill you old woman chill you old woman chill you old woman chill you old woman chill you old woman chill you old woman chill you old woman chill you old woman chill you old woman chill yo"
