How is glass made?,"Glass is usually made by melting sand, soda ash and limestone in a furnace at 1500 degrees celsius or higher.The molten glass is then transferred into moulds to cool, which forms the shape of the final product.","Glass is typically manfactured with three different steps: 1) melting the sand (silica oxide), and additives such as a basic oxide and a coloring agent. By stirring you can prevent that it burns on the sides. Part of the water is already added during this step. But water is also added in step 2, to prevent the liquid from sticking to the walls. Because water dissolves many oxides it is important to choose the right water quality otherwise the composition will change. Even water containing salt is not suitable. Even water containing salt is not suitable. Even water containing salt is not suitable. Even water containing salt is not suitable. Even water containing salt is not suitable. Even water containing salt is not suitable. Even water containing salt is not suitable. Even water containing salt is not suitable. Even water containing salt is not suitable. Even water containing salt is not suitable. Even water containing salt is not suitable. Even water containing salt is not suitable. Even water containing salt is not suitable. Even water containing salt is not suitable. Even water containing salt is not suitable."
What are the causes of World War II?,The causes of WWII are: <ul><li>,"World War II began in response to Adolf Hitler's invasion of Poland on September 1, 1939."
Explain the importance of biodiversity.,Biodiversity is essential for life on Earth. It provides us with many benefits that we depend on for our survival.,It is important because it help maintain a dynamic environment for many organisms to live in a variety of different ways.
What is the structure of an atom?,"Atoms are made up of three main parts, a nucleus and electrons. The nucleus is composed of protons and neutrons. Protons have a positive charge while neutrons carry no charge at all. Electrons carry a negative charge that balances out the positively charged protons in the nucleus. Atoms can also be thought of as consisting of a central nucleus surrounded by a cloud of negatively charged electrons.The electrons are arranged into shells, like layers of an onion. Each shell has a different energy level and is associated with one or more subshells.The electrons within each shell move about randomly, but they are not free to leave the atom because of their attraction to the positively charged nucleus.The electrons within each shell move about randomly, but they are not free to leave the atom because of their attraction to the positively charged nucleus.The electrons within each shell move about randomly, but they are not free to leave the atom because of their attraction to the positively charged nucleus.","Atoms consist of a nucleus and one or more electrons. Atoms with one electron are hydrogen atoms, helium has 2 electrons, etc. Atoms with no electrons are protons, helium has 2 protons, etc. Atoms with one neutron are neutrons, helium has 1 neutron, etc. Atoms with one neutron are proton, helium has 1 proton, etc. Atoms with one neutron are proton, helium has 1 proton, etc. Atoms with one neutron are proton, helium has 1 proton, etc. Atoms with one neutron are proton, helium has 1 proton, etc. Atoms with one neutron are proton, helium has 1 proton, etc. Atoms with one neutron are proton, helium has 1 proton, etc. Atoms with one neutron are proton, helium has 1 proton, etc. Atoms with one neutron are proton, helium has 1 proton, etc. Atoms with one neutron are proton, helium has 1 proton, etc. Atoms with one neutron are proton, helium has 1 proton, etc. Atoms with one neutron are proton, helium has 1 proton, etc. Atoms with one neutron are proton, helium has 1 proton, etc. Atoms with one neutron are proton, helium has 1 proton, etc. Atoms with one neutron are proton, helium has 1 proton, etc. Atoms with one neutron are proton, helium has 1 proton, etc. Atoms with one neutron are proton, helium has 1 proton, etc."
How does a camera work?,"A camera is a device that captures images, typically in digital form, and stores them on a memory card or hard drive. Cameras can be used to take pictures of scenery, people, objects, and other things. They can also be used to record videos.The main parts of a camera include the lens, sensor, shutter, aperture, and focus mechanism. The lens focuses light onto the sensor, which converts the light into digital signals. The shutter controls how long the light is exposed to the sensor. The aperture controls how much light enters the lens. The focus mechanism adjusts the distance between the lens and the sensor to make sure everything is in focus.",A camera uses a mechanical shutter to allow light to fall on a film. By blocking the passage of light with a shutter for a specific interval you control how much light you allow on your film. By using different shutter speeds you change the amount of light that falls on a piece of film you control the exposure of a scene on film. By using different apertures you change the size of the opening on a lens you change the speed with which you allow light on film you control depth of field. Giving you control over both shutter speed and aperture you can choose a proper combination you control your exposure of a scene on film you control both a scene brightness and a scene sharpness. By using different film you change film sensitivity you control film speed you control film speed you control film speed you control film speed you control film speed you control film speed you control film speed you control film speed you control film speed you control film speed you control film speed you control film speed you control film speed you control film speed you control film speed you control film speed you control film speed you control film speed you control film speed you control film speed you control film speed you control film speed you control film speed you control film speed you control film speed you control film speed you control film speed you control film speed you control film speed you control film speed you control film speed you control film speed you control film speed you control film speed you control film speed you control film speed you control film speed you control film speed you control film speed you control film speed you control film speed you control film speed you control film speed you control film speed you control film speed you control film speed you control film speed you control film You control shutter speed you control shutter speed you control shutter speed you control shutter speed you control shutter speed you control shutter speed you control shutter speed you control shutter speed you control shutter speed you control shutter speed you control shutter speed you control shutter speed you control shutter speed you control shutter speed you control shutter speed you control shutter speed you control shutter speed you control shutter speed you control shutter speed you control shutter speed you control shutter speed you control shutter speed you control shutter speed you control shutter speed you control shutter speed you control shutter speed you control shutter speed you control shutter speed you control shutter speed you control shutter speed you control shutter speed you control shutter speed you control shutter speed you control shutter speed you control shutter speed you control shutter speed you control shutter speed you control shutter speed you control shutter speed you control shutter By moving the film you control film movement you control film movement you control film movement you control film movement you control film movement you control film movement you control film movement you control film movement you control film movement you control film movement you control film movement you control film movement you control film movement you control film movement you control film movement you control film movement you control film movement you control film movement you control film movement you control film movement you control film movement you control film movement you control film movement you control film movement you control film movement you control film movement you control film movement you control film movement you control film movement you control film movement you control film movement you control film movement you control film movement you control film movement you control film movement you control film movement you control film movement you control film movement you control film movement you control film movement you control film movement you control film movement you control film movement you control film movement you control film movement you control film movement you control film movement you control film movement you control film Do you see now? In this way you control everything in photography. Many people think you do not have control over anything. Light is what you do not control it is what nature does you just use it what you can control is yourself you are responsible for yourself you control yourself you control yourself you control yourself you control yourself you control yourself you control yourself you control yourself you control yourself you control yourself you control yourself you control yourself you control yourself you control yourself you control yourself you control yourself you control yourself you control yourself you control yourself you control yourself you control yourself you control yourself you control yourself you control yourself you control yourself you control yourself you control yourself you control yourself you control yourself you control yourself you control yourself you control yourself you control yourself you control yourself you control yourself you control yourself you control yourself you control yourself you control yourself you control yourself you control yourself You control yourself you control yourself you control yourself you control yourself you control yourself you control yourself you control yourself you control yourself you control yourself you control yourself you control yourself you control yourself you control yourself you control yourself you control yourself you control yourself you control yourself yo By moving the camera you control camera movement you control camera movement you control camera movement you control camera movement you control camera movement you control camera movement you control camera movement you control camera movement you control camera movement you control camera movement you control camera movement you control camera movement you control camera movement you control camera movement you control camera movement you control camera movement you control camera movement you control camera movement you control camera movement you control camera movement you control camera movement you control camera movement you control camera movement you control camera movement you control camera movement you control camera movement you control camera movement you control camera movement you control camera movement you control camera movement you control camera movement you control camera movement you control camera movement you control camera movement you control camera movement you control camera movement you control camera movement you control camera movement you control camera movement you control camera movement you control camera movement you control camera movement you control camera movement you control camera movement you control camera movement you control camera movement you control camera movement you control camera movement you control camera Movement you control camera movement you control camera movement you control camera movement you control camera movement you control camera movement you control camera movement you control camera movement you control camera movement you control camera movement you control camera movement you control camera movement you control camera movement you control camera movement you control camera movement you control camera movement you control camera movement you control camera movement you control camera movement you control camera movement you control camera movement you control camera movement you control camera movement you control camera movement you control camera movement you control camera movement you control camera movement you control camera movement you control camera movement you control camera movement you control camera movement you control camera movement you control camera movement you control camera movement you control camera movement you control camera movement you control camera movement you control camera movement you control camera movement you control camera movement you control camera movement you control camera movement you control camera movement you control camera movement you control camera movement you control camera movement you control camera movement you control camera movement you control camera movement you control camera movement you control Many people ask me why I like photography so I will tell you why I love it I love it because it gives me control It is important you understand one thing I teach you I will help you understand it I hope you understand it I hope you understand it I hope you understand it I hope you understand it I hope you understand it I hope you understand it I hope you understand it I hope you understand it I hope you understand it I hope you understand it I hope you understand it I hope you understand it I hope you understand it I hope you understand it I hope you understand it I hope you understand it I hope you understand it I hope you understand it I hope you understand it I hope you understand it I hope you understand it I hope you understand it I hope you understand it I hope you understand it I hope you understand it I hope you understand it I hope you understand it I hope you understand it I hope you understand it I hope you understand it I hope you understand it I hope yo Many people ask me why I like photography so I will tell you why I love it I love it because it gives me control It is important you understand one thing I teach you I will help you understand it I hope you understand it I hope you understand it I hope you understand it I hope you understand it I hope you understand it I hope you understand it I hope you understand it I hope you understand it I hope you understand it I hope you understand it I hope you understand it I hope you understand it I hope you understand it I hope you understand it I hope you understand it I hope you understand it I hope you understand it I hope you understand it I hope you understand it I hope you understand it I hope you understand it I hope you understand it I hope you understand it I hope you understand it I hope you understand it I hope you understand it I hope you understand it I hope you understand it I hope you understand it I hope you understand it I hope you understand it I hope yo Many people ask me why I like photography so I will tell you why I love it I love it because it gives me control It is important you understand one thing I teach you I will help you understand it I hope you understand it I hope you understand it I hope you understand it I hope you understand it I hope you understand it I hope you understand it I hope you understand it I hope you understand it I hope you understand it I hope you understand it I hope you understand it I hope you understand it I hope you understand it I hope you understand it I hope you understand it I hope you understand it I hope you understand it I hope you understand it I hope you understand it I hope you understand it I hope you understand it I hope you understand it I hope you understand it I hope you understand it I hope you understand it I hope you understand it I hope you understand it I hope you understand it I hope you understand it I hope you understand it I hope you understand it I hope yo Many people ask me why I like photography so I will tell you why I love it I love it because it gives me control It is important you understand one thing I teach you I will help you understand it I hope you understand it I hope you understand it I hope you understand it I hope you understand it I hope you understand it I hope you understand it I hope you understand it I hope you understand it I hope you understand it I hope you understand it I hope you understand it I hope you understand it I hope you understand it I hope you understand it I hope you understand it I hope you understand it I hope you understand it I hope you understand it I hope you understand it I hope you understand it I hope you understand it I hope you understand it I hope you understand it I hope you understand it I hope you understand it I hope you understand it I hope you understand it I hope you understand it I hope you understand it I hope you understand it I hope you understand it I hope yo Many people ask me why I like photography so I will tell you why I love it I love it because it gives me control It is important you understand one thing I teach you I will help you understand it I hope you understand it I hope you understand it I hope you understand it I hope you understand it I hope you understand it I hope you understand it I hope you understand it I hope you understand it I hope you understand it I hope you understand it I hope you understand it I hope you understand it I hope you understand it I hope you understand it I hope you understand it I hope you understand it I hope you understand it I hope you understand it I hope you understand it I hope you understand it I hope you understand it I hope you understand it I hope you understand it I hope you understand it I hope you understand it I hope you understand it I hope you understand it I hope you understand it I hope you understand it I hope you understand it I hope you understand it I hope yo Many people ask me why I like photography so I will tell you why I love it I love it because it gives me control It is important you understand one thing I teach you I will help you understand it I hope you understand it I hope you understand it I hope you understand it I hope you understand it I hope you understand it I hope you understand it I hope you understand it I hope you understand it I hope you understand it I hope you understand it I hope you understand it I hope you understand it I hope you understand it I hope you understand it I hope you understand it I hope you understand it I hope you understand it I hope you understand it I hope you understand it I hope you understand it I hope you understand it I hope you understand it I hope you understand it I hope you understand it I hope you understand it I hope you understand it I hope you understand it I hope you understand it I hope you understand it I hope you understand it I hope you understand it I hope yo Many people ask me why I like photography so I will tell you why I love it I love it because it gives me control It is important you understand one thing I teach you I will help you understand it I hope you understand it I hope you understand it I hope you understand it I hope you understand it I hope you understand it I hope you understand it I hope you understand it I hope you understand it I hope you understand it I hope you understand it I hope you understand it I hope you understand it I hope you understand it I hope you understand it I hope you understand it I hope you understand it I hope you understand it I hope you understand it I hope you understand it I hope you understand it I hope you understand it I hope you understand it I hope you understand it I hope you understand it I hope you understand it I hope you understand it I hope you understand it I hope you understand it I hope you understand it I hope you understand it I hope you understand it I hope yo
What is mindfulness?,"Mindfulness is the act of being aware of your thoughts, feelings, and sensations in the present moment without judgement.","It's a state of active awareness of what you are sensing and feeling in the moment, without interpretation or judgment. Do something you like and pay attention to everything you experience: body sensations, feelings, thoughts, emotions. Relax your body and turn your mind into your body. Relax your body and turn your mind into your body. Relax your body and turn your mind into your body. Relax your body and turn your mind into your body. Relax your body and turn your mind into your body. Relax your body and turn your mind into your body. Relax your body and turn your mind into your body. Relax your body and turn your mind into your body. Relax your body and turn your mind into your body. Relax your body and turn your mind into your body. Relax your body and turn your mind into your body. Relax your body and turn your mind into your body. Relax your body and turn your mind into your body. Relax your body and turn your mind into your body. Relax your body and turn your mind into your body. Relax your body and turn your mind into your body. Relax your body and turn your mind into your body. Relax your body and turn your mind into your body."
Describe the process of recycling.,"Recycling is the process of recovering products and materials from waste, to be used in new products.The purpose of recycling is to conserve natural resources, save energy, reduce pollution, reduce greenhouse gas emissions, and decrease the amount of waste sent to landfills and incinerators.The most common products that are recycled are paper, glass, plastic, metals, textiles, electronics, and rubber.",Recycling is a process that reduces human impact on environment by converting waste materials into new products to prevent them from going to landfills and increasing a demand for new natural resources to make new products.
