What is virtual reality?,"Virtual reality is a technology that uses a computer to create a simulated, interactive environment. There you can interact with images and sounds as if you were present in that environment.

Virtual reality is the next big thing after the internet.

There are many things that are possible in virtual reality. For example:

- You can visit a museum or a country.
- You can see a concert.
- You can play games or sports.
- You can do a job in a virtual office.
- You can meet people and talk to them.

In the future, virtual reality will be used for many things. It will be used for education, for work, and for entertainment.

Virtual reality is a new technology. It is still being developed and improved. As it becomes more advanced, it will be used for more and more things.

Virtual reality is a new technology that is just beginning to be used. It has the potential to change","Virtual Reality is a three-dimensional, computer generated environment which can be explored and interacted with by a person.

As such, Virtual Reality is a simulation and can be of a real environment, or an imaginary one.

The simulation can be visual, auditory or in any other way you can imagine.

Virtual Reality is commonly used as a marketing tool to showcase a product or a place.

Virtual Reality can be used in education and medicine to teach people or to train them, as in pilot training.

Virtual Reality is a good way to teach people to use dangerous things, without the danger of getting hurt, as in surgery training, or even in practicing driving a car.<>","Virtual reality is a technology that uses a computer to create a simulated interactive environment. There can be interact with images and sounds as if it were present in that environment.

Virtual reality is the next big thing after the Internet.

There are many things that are possible in virtual reality. For example:

- You can visit a museum or a country.
- You can see a concert.
- You can play games or sports.
- You can do a job in a virtual office.
- You can meet people and talk to them.

In the future, virtual reality will be used for many things. It will be used for education, for work and for entertainment.

Virtual reality is a new technology. It is still developing and improving. As it becomes more advanced, it will be used for more and more things.

Virtual reality is a new technology that just begins to be used. It has the potential to change","Virtual reality is a computers -generated three -dimensional environment with which a person can explore and interact.

As such, virtual reality is a simulation and can be of a real, or imaginary environment.

Simulation can be visual, auditory or in any other way that I can imagine.

Virtual reality is commonly used as a marketing tool to show a product or place.

Virtual reality can be used in education and medicine to teach people or train them, as in the training of pilots.

Virtual reality is a good way to teach people to use dangerous things, without the danger of hurting themselves, as in surgery training or even to practice conducting a car.<>"
How do vaccines work?,"Vaccines contain weakened forms of viruses. When you get a vaccination the weakened viruses cause your immune system to learn how to fight a real infection.



If you have been vaccinated, your body is prepared to fight the next time you encounter a virus.



Sometimes, your body may need help or extra boost. Booster shots are vaccines that you get later in life to keep you up to date.



When a vaccination is successful, your immune system is “trained” to recognize the virus and fight it off, so you don’t get sick. Some vaccines contain a weakened or killed version of the virus. Because these viruses are so weak, they can’t make you sick.



The vaccine version of the virus is a little like a practice round in a sports tournament. When you get the vaccine, your immune system learns how to fight the virus and wins","Vaccines contain a weakened form of the virus, or a protein that forms the coating of the virus.

As the body's immune system responds to the vaccine, it starts to build an arsenal of antibodies and white blood cells.

The next time it encounters the real virus, the body can immediately go into action, destroying the virus before it can cause damage.

Vaccination doesn't provide perfect immunity. Some vaccinated people will still get the disease if they are exposed.

However, vaccination significantly reduces the risk, and for serious illnesses, vaccinated people are much less likely to die from the disease.

Vaccination also prevents viruses from mutating. When lots of people are vaccinated, viruses are no longer spreading as easily.

With less opportunity to mutate, viruses are less likely to develop resistance to the vaccine, so vaccination remains effective.

","Vaccines contain weakened virus forms. When receiving a vaccine, weakened viruses make their immune system learn to fight a real infection.



If you have been vaccinated, your body is prepared to fight the next time you find a virus.



Sometimes, your body may need additional help or impulse. Reinforcement shots are vaccines that you get later in life to keep up.



When a vaccination is successful, its immune system is ""trained"" to recognize the virus and fight it, so that you do not get sick. Some vaccines contain a weakened or murdered version of the virus.



The virus vaccine version is a bit like a practice round in a sports tournament. When you get the vaccine, your immune system learns to fight the virus and win","Vaccines contain a weakened shape of the virus, or a protein that forms the virus coating.

As the body's immune system responds to the vaccine, it begins to build an arsenal of white antibodies and blood cells.

The next time you meet the real virus, the body can immediately take action, destroying the virus before it can cause damage.

Vaccination does not provide a perfect immunity. Some vaccinated people will still get the disease if exposed.

However, vaccination significantly reduces risk, and for serious diseases, vaccinated people are much less likely to die from the disease.

Vaccination also prevents viruses from muting. When many people are vaccinated, viruses no longer spread so easily.

With less opportunity to mutate, viruses are less likely to develop vaccine resistance, so vaccination is still effective."
What is the internet?,"The internet is a global system of interconnected computer networks that use the standardized internet protocol suite (TCP/IP) to link devices worldwide. It is a network of networks that consists of private, public, academic, business, and government networks of local to global scope, linked by a broad array of electronic, wireless, and optical networking technologies.<>","The Internet is a global system of interconnected computer networks that use the standard Internet Protocol Suite (TCP/IP) to communicate between networks and devices. The Internet is a network of networks that consists of private, public, academic, business, and government networks of local to global scope, linked by a broad array of electronic, wireless, and optical networking technologies. The Internet was formalized in 1995 with the creation of the World Wide Web (www), which has become one of its most important services.

The Internet is a unique, global, public network. This means that all the networks that make up the Internet, although diverse in type and ownership, are interconnected and therefore allow communication between any two points on the network. The Internet is a ""network of networks."" The Internet is an ""intranet,"" or a ""local area network."" The Internet is a ""computer network."" The Internet is a ""communications network.""

The Internet is","Internet is a global system of interconnected computer networks that use the standardized Internet protocol set (TCP/IP) to link devices worldwide. It is a network of networks that consists of private, public, academic, commercial and governmental networks ofLocal to global scope, linked by a wide range of electronic, wireless and optical network technologies.<>","Internet is a global interconnected computer networks system that use the standard Internet protocol set (TCP/IP) to communicate between networks and devices. Internet is a network of networks consisting of private, public, academic, commercial and governmental networks ofLocal to global scope, linked by a wide range of electronic, wireless and optical network technologies. Internet was formalized in 1995 with the creation of the World Wide Web (WWW), which has become one of its most important services.

The Internet is a unique public network, global. This means that all the networks that make up the Internet, although diverse in type and property, are interconnected and, therefore, allow communication between two points on the network.Internet is a ""network ofNetworks "".Internet is an"" intranet ""or a"" local area network. ""Internet is a"" computer network. ""Internet is a"" communications network. ""

Internet is"
Describe the process of making chocolate.,"
The process of making chocolate is a long, complex one that starts with cocoa beans. These beans are harvested from cacao trees, a type of evergreen that grows in tropical regions around the world.

Once the cocoa beans are harvested, they are roasted to bring out their flavor. Then, the beans are ground into a fine powder called cocoa liquor. This liquor is mixed with sugar and other ingredients to create a chocolate paste, which is then molded into bars, truffles, or other forms.

Finally, the chocolate is tempered to give it a glossy finish and a smooth texture. This process involves heating and cooling the chocolate to specific temperatures, which is a delicate art that requires careful attention.

In conclusion, the process of making chocolate is a complex one that begins with cocoa beans and ends with a delicious treat.

</>","
The process of making chocolate is a long, complex one that starts with cocoa beans. These beans are harvested from cacao trees, a type of evergreen that grows in tropical regions around the world.

The beans are then fermented, a process that helps to remove the bitterness from the beans and brings out the chocolatey flavor. After fermentation, the beans are dried and roasted, which gives them a richer flavor.

Next, the roasted beans are ground, a process that releases the cocoa butter, which gives chocolate its smooth texture. The ground beans are then mixed with sugar, milk, and other ingredients to create the final product, which often includes chocolate liquor, a paste that contains cocoa solids and cocoa butter.

The finished chocolate is then cooled, tempered, and molded into the desired shape, whether it be a chocolate bar or chocolate candy.

","The chocolate manufacturing process is long and complex that begins with cocoa grains. These beans are harvested from cocoa trees, a type of perennial leaf that grows in tropical regions around the world.

Once cocoa beans are harvested, they are roasted to get their flavor. Then, beans are ground in a fine powder called cocoa liquor. This liquor is mixed with sugar and other ingredients to create a chocolate paste, which then laterIt is molded in bars, truffles or other forms.

Finally, chocolate is attenuated to give it a brilliant finish and a soft texture. This process implies heating and cooling chocolate at specific temperatures, which is a delicate art that requires careful attention.

In conclusion, the chocolate manufacturing process is complex that begins with cocoa beans and ends with a delicious gift.

</>","The chocolate manufacturing process is long and complex that begins with cocoa grains. These beans are harvested from cocoa trees, a type of perennial leaf that grows in tropical regions around the world.

Then the beans are fermented, a process that helps eliminate the bitterness of the beans and draws the taste of chocolate. After fermentation, beans dry and roast, which gives them a richer flavor.

Next, roasted beans are ground, a process that releases cocoa butter, which gives chocolate its soft texture. Then, ground beans are mixed with sugar, milk and other ingredients to create the final product, than toOften it includes chocolate liquor, a paste containing cocoa and cocoa butter solids.

The finished chocolate cools, is tempered and molded in the desired form, be it a chocolate bar or chocolate sweets."
What is a haiku?,"A haiku is a poem that has three lines. Each line has 5, 7, and 5 syllables, respectively. The subject of the poem is nature and the seasons. A haiku expresses the beauty of nature and the passing of time. It is a short poem that makes a big statement. The haiku is a poem that was invented by the Japanese. It is often compared to a Japanese painting (ukyo-e). The haiku can be described as a poem-picture. A haiku is a poem with a very strong image. The haiku is one of the most popular poetic forms in the world. It is also the most difficult to write in a good way. It is a poem that is a little longer than a haiku. The haiku is often used as a springboard for a more elaborate poem. The haiku has many variations. There is the haiku-tanka, haiku-tanka-tanka",A haiku is a three line poem that has a total of 17 syllables (on/uk/e).<>,"A haiku is a poem that has three lines. Each line has 5, 7 and 5 syllables, respectively. The theme of the poem is nature and stations. A haiku expresses the beauty of nature and the passage of time. It is a poemshort that makes a great statement. The haiku is a poem that was invented by the Japanese. It is often compared to a Japanese painting (UKYO-E). The haiku can be described as an image poem. A Haiku is a poem with a poem with avery strong image. Haiku is one of the most popular poetic forms in the world. It is also the most difficult to write in good sense. It is a poem that is a little longer than a haiku.The haiku is often used as a springboardFor a more elaborate poem. The haiku has many variations. There is haiku-tanka, haiku-tanka-teka",A haiku is a three -line poem that has a total of 17 syllables (in/United Kingdom/e).<>
How do bees make honey?,"
The honey bee (Apis mellifera) starts by collecting nectar from flowers. A bee has a long tongue and a honey stomach that can hold a lot of nectar. Bees collect nectar from flowers and store it in their honey stomach. The honey stomach is different from the normal stomach.

The honey stomach has special enzymes that break down the nectar. This changes the nectar into honey. Because of these enzymes, the nectar gets thicker and thicker.

Bees store the honey in a honeycomb. A honeycomb is made of lots of little hexagonal honey cells. Bees build the honeycomb with wax that they produce on their own. The wax is secreted from glands on their abdomen.

When the honey is thick enough, bees store it in the honeycombs. A group of bees called a swarm takes care of","
The honey bee (Apis mellifera) makes honey bee honey by eating pollen and nectar and then regurgitating a honey-like substance into honeycomb.

Honey bee honey is a foodstuff made by honey bees from the nectar of flowers, from which the honey bee derives energy for flying.

A hive of honey bees in a garden in the United States

Honey bee honey is composed of carbohydrates and very little protein. The primary sugar component is fructose, followed by glucose, with lesser amounts of sucrose. In addition to sugars, honey bee honey also includes other components such as flavonoids, phenolic acids, vitamins and minerals.

Honey bee honey is a complex substance containing compounds important to the honey bee. Honey bee honey is a foodstuff made by","The honey bee (Apis mellifera) begins by collecting flower nectar. A bee has a long tongue and a honey stomach that can contain a lotIt is different from the normal stomach.

The honey stomach has special enzymes that break down the nectar. This changes the nectar in honey.

Bees store honey in a honeycomb. A honeycomb is made of many small hexagonal honey cells. Bees build the honeycomb with wax that they produce on their own. The wax is secreted from the glands in their abdomen.

When honey is thick enough, bees store it in the honeycombs. A group of bees called swarm is responsible for","The honey bee (Apis Mellifera) makes honey honey by eating pollen and nectar and then regurgitating a substance similar to honey in the honeycomb.

Honey Bee Honey is a food made by honey bees of the flower nectar, from which the honey bee derives energy to fly.

A hive of honey bees in a garden in the United States

Honey bee honey is composed of carbohydrates and very little protein. The primary sugar component is fructose, followed by glucose, with lower quantities of sucrose. In addition to sugars, honey of bees also includes other components, such as flavonoids, acidsphenolic, vitamins and minerals.

Honey Bee Honey is a complex substance that contains important compounds for honey bee.honey Bee Honey is a food made by"
What is the theory of relativity?,"The theory of relativity is a theory of physics that explains the laws of nature in the presence of the general theory of relativity, which describes gravitation and the structure of spacetime.<>","The theory of relativity is a theory of space and time developed in the early 20th century by Albert Einstein.
As the name implies, a basic principle of this theory is that space and time are interrelated.<>","The theory of relativity is a theory of physics that explains the laws of nature in the presence of the general theory of relativity, which describes the gravitation and structure of space -time.<>","The theory of relativity is a theory of space and time developed in the early twentieth century by Albert Einstein.
As the name implies, a basic principle of this theory is that space and time are interrelated.<>"
Explain the function of the lungs.,"The lungs are organs of respiration, responsible for gas exchange between the body and the environment. They are located in the thoracic cavity (chest) and consist of a right and left lung, each divided into lobes. Lungs are spongy, porous organs that are made up of a network of airways (air passages) and alveoli (air sacs).<>","The lungs provide gas exchange (O2 into the body, CO2 out of the body)<>","The lungs are breathing organs, responsible for the exchange of gases between the body and the environment. They are located in the thoracic cavity (chest) and consist of a right and left lung, each divided into lobes. The lungs are spongy organs andporous that are formed by a network of airways (air passages) and alveoli (aerial bags).<>","The lungs provide gas exchange (O2 in the body, CO2 outside the body) <>"
What is a balanced diet?,"A balanced diet is a diet that contains the right amount of calories and nutrients the body needs to function normally.
<>","A balanced diet includes many different types of foods, for example bread, milk, fruit and vegetables, meat and fish.

As a general guideline a balanced diet will be higher in carbohydrates than protein.<>","A balanced diet is a diet that contains the correct amount of calories and nutrients that the body needs to function normally.
<>","A balanced diet includes many different types of food, for example, bread, milk, fruits and vegetables, meat and fish.

As a general guide, a balanced diet will be greater in carbohydrates than in protein.<>"
Describe the phases of the moon.,"
The Moon goes through eight phases: New, Waxing Crescent, First Quarter, Waxing Gibbous, Full, Waning Gibbous, Last Quarter, and Waning Crescent.

<>","
The moon goes through eight phases: new, waxing crescent, first quarter, waxing gibbous, full, waning gibbous, last quarter, and waning crescent.

A new moon occurs when the moon and sun are on the same side of Earth. The moon is invisible from Earth, as it's positioned between the Earth and the sun and the side facing the Earth is not lit up by the sun.

A waxing crescent occurs when the moon is in the first quarter phase, between the new moon and the first quarter.

A first quarter moon occurs when the moon is half-lit and positioned at a right angle to the Earth and sun.

A waxing gibbous moon occurs when over half of the moon is lit up by the sun and positioned between the first quarter moon and the full moon.

A full moon occurs when the moon and sun are opposite to each","The moon passes through eight phases: New and growing crescent, first quarter, gibrous wax hair removal, full, diminishing gibosa, last quarter and waning crescent.

<>","The moon passes through eight phases: new and growing growing, first quarter, gibrous wax hair removal, full, diminished gibosa, the last quarter and the waning crescent.

A new moon occurs when the moon and the sun are on the same side of the earth. The moon is invisible from the earth, since it is placed between the earth and the sun and the side that looks at the earth is not illuminated by the sun.

A removal crescent occurs when the moon is in the phase of the first quarter, between the new moon and the first quarter.

A first moon quarter occurs when the moon is half lighting and is placed at right angles with the earth and the sun.

A gibosa wax hair removal occurs when the sun illuminates more than half of the moon and is placed between the first quarter of the moon and the full moon.

A full moon occurs when the moon and the sun are opposed to each"
What is artificial intelligence?,Artificial intelligence (AI) is a term used for designing computers capable of performing tasks that normally require human intelligence.<>,"
The term ""artificial intelligence"" is a very broad one. There's the branch that studies general intelligence (machine learning, artificial general intelligence or AGI) as well as the branch that studies particular intelligent agents or tasks (machine reasoning, expert systems, etc.), and then there are the subbranches like neural networks, symbolic AI, etc..

That said, most people use the term ""artificial intelligence"" to refer to the branch that studies particular intelligent agents. This includes things like expert systems, which were a very popular area of research in the 1980's, which involved the use of ""rules"" to solve problems; also included in this category is AI applications like autonomous vehicles or AI programs that beat people at Go or Chess.

As a final note, ""artificial general intelligence"" is a somewhat misnomer. In order to be ""general"" an AI agent would need to be able to solve any task that",Artificial intelligence (AI) is a term used to design computers capable of performing tasks that normally require human intelligence.<>,"The term ""artificial intelligence"" is very wide. There is the branch to study general intelligence (automatic learning, artificial general intelligence or AGI), as well as the branch that studies particular intelligent agents or tasks (machine reasoning, expert systems, etc.), and then there are sub -banks such as neuronal networks, symbolic AI, etc.

That said, most people use the term ""artificial intelligence"" to refer to the branch that studies private intelligent agents. This includes things like Expert Systems, which were a very popular research area in the 1980s, which implied theUse of ""rules"" to solve problems; applications of AI as autonomous vehicles or AI programs that defeat people in go or chess are also included in this category.

As a final note, ""artificial general intelligence"" is a somewhat incorrect name. To be ""general"", an AI agent would need to be able to solve any task that"
